review,rating,date,bank,source,sentiment,sentiment_score
what is this app problem???,1,2025-06-05,CBE,Google Play,negative,0.9996225833892822
not functional,1,2025-06-05,CBE,Google Play,negative,0.999778687953949
"everytime you uninstall the app you have to reach them out physically. very oldy! if that's one of security layer, they'd check for fraud attempt via app source directly(source:- app store, play store ... etc) implicitly ! we are in 2025, physical presence for every app install is traditional(traditionally very rare).",1,2025-06-04,CBE,Google Play,negative,0.9905162453651428
yetemeta,1,2025-06-03,CBE,Google Play,positive,0.6553664803504944
it is not safety,1,2025-06-03,CBE,Google Play,negative,0.9997867941856384
it is like a childish app make it better the worst I have ever seen,1,2025-06-02,CBE,Google Play,negative,0.9997958540916443
🤬🤬🤬🤬 network 🛜,1,2025-05-26,CBE,Google Play,negative,0.685613214969635
its not fast,1,2025-05-24,CBE,Google Play,negative,0.9949808716773987
ok,1,2025-05-24,CBE,Google Play,positive,0.9997851252555847
"Very bad, can't even load they need to improve their services.",1,2025-05-22,CBE,Google Play,negative,0.9998165965080261
the most boring Mobil banking application in ethiopia.Please use alternative private banks mobile banking apps,1,2025-05-22,CBE,Google Play,negative,0.9986202716827393
I hate this app 😒,1,2025-05-22,CBE,Google Play,negative,0.9996378421783447
its not working over safari network,1,2025-05-22,CBE,Google Play,negative,0.9991377592086792
oldie,1,2025-05-22,CBE,Google Play,negative,0.6663177013397217
it doesn't work,1,2025-05-21,CBE,Google Play,negative,0.9997813105583191
"This app is good, and we are using it well",1,2025-05-21,CBE,Google Play,positive,0.999855637550354
በጣም ከርፋፋ,1,2025-05-21,CBE,Google Play,negative,0.7850590348243713
poor service,1,2025-05-21,CBE,Google Play,negative,0.9996534585952759
the most annoying mobile banking app I've ever seen,1,2025-05-20,CBE,Google Play,negative,0.9994208812713623
always disappointing ! especially the iOS one !! some similar local applications are extremely superior to this application!! Really disappointing!,1,2025-05-17,CBE,Google Play,negative,0.9996201992034912
customer service is bad nothing is good about this bank,1,2025-05-13,CBE,Google Play,negative,0.9996613264083862
This app don't have self activation only you have to look near cbe branch that's disgusting,1,2025-05-10,CBE,Google Play,negative,0.9960438013076782
"Am sorry but what does developer mode do to the application ? hack it ? are you sure you are developer or are you stupid, doesnt makes sense,",1,2025-05-08,CBE,Google Play,negative,0.9997019171714783
why the app telling me to turn of developer options please fix it.,1,2025-05-07,CBE,Google Play,negative,0.9990994930267334
needs improvement,1,2025-05-06,CBE,Google Play,negative,0.9966731071472168
i miss the old one i couldn't send my mony to other bank..,1,2025-05-06,CBE,Google Play,negative,0.995843231678009
If any developer is reading this please fix the screenshot functionality or at least the download button should work flawlessly without me touching it twenty times.,1,2025-05-05,CBE,Google Play,negative,0.9975224137306213
wow,1,2025-05-05,CBE,Google Play,positive,0.999592125415802
it's very low quality application,1,2025-05-04,CBE,Google Play,negative,0.9996594190597534
አዛ,1,2025-05-04,CBE,Google Play,negative,0.6970565915107727
okay 👍 but sometimes busy,1,2025-05-03,CBE,Google Play,negative,0.8515542149543762
the worst commercial company that fails to do even the most normal things again and and again.,1,2025-05-03,CBE,Google Play,negative,0.9997990727424622
Unreliable!,1,2025-05-02,CBE,Google Play,negative,0.9997379183769226
worest app like that bank for security and network access,1,2025-05-02,CBE,Google Play,negative,0.9927296042442322
not bad not good,1,2025-05-02,CBE,Google Play,negative,0.9715350866317749
the worst Mobile banking i have ever seen in my life,1,2025-04-26,CBE,Google Play,negative,0.9997807145118713
the Best,1,2025-04-26,CBE,Google Play,positive,0.9998332262039185
to other bank is bad,1,2025-04-25,CBE,Google Play,negative,0.9997149109840393
amazing,1,2025-04-19,CBE,Google Play,positive,0.999875545501709
why removing screenshot feature why?,1,2025-04-18,CBE,Google Play,negative,0.9981147050857544
i can't take screenshot,1,2025-04-18,CBE,Google Play,negative,0.9897894263267517
Can't scan/recognize other banks' Interoperable QR Codes,1,2025-04-13,CBE,Google Play,negative,0.9983273148536682
"less network, specially to make fee for utility purpose",1,2025-04-11,CBE,Google Play,negative,0.994688868522644
very very nice aplication,1,2025-04-08,CBE,Google Play,positive,0.9998292922973633
bring back the screenshot feature.,1,2025-04-05,CBE,Google Play,positive,0.9942916631698608
best app to experience him that to smooth transaction among the customers,1,2025-04-05,CBE,Google Play,positive,0.9985142350196838
"I don't understand the reason, why I need to disable developer options to access the app, it has no security risks nor does it hinder the app's functionalities. This goes out to the dev, I hope your life is filled with inconveniences.",1,2025-04-02,CBE,Google Play,negative,0.9986600875854492
Dear cbe this app is not comparable with 21century and pls try to solve it.💀💀💀,1,2025-04-01,CBE,Google Play,negative,0.9995038509368896
in this update why screenshoot is disabled now it's not working,1,2025-03-28,CBE,Google Play,negative,0.9996315240859985
"The latest update prevents taking screenshots, which is really annoying! please allow us to take screenshots! we need it for evidence (particularly, in case of transfer failure!).",1,2025-03-27,CBE,Google Play,negative,0.9977697134017944
Doesn't work properly. It crashes some many times. commercial bank of Ethiopia not only the application but also sending money to own CBE birr doesn't get your money in your bank account. forcefully you must wait 3-5 days to get your money back to your account. walk up CBE the world is going to decentralized finance.,1,2025-03-26,CBE,Google Play,negative,0.9995678067207336
It crashes multiple times everytime you launch it. Fix it. Edit: crash fixed but screenshots has been disabled. I don't know who thought this was a good idea.,1,2025-03-26,CBE,Google Play,negative,0.9995493292808533
"I fails mid transaction, No screenshot, download don't work, link shared not working bring back the old app this is usless",1,2025-03-26,CBE,Google Play,negative,0.9996533393859863
some times it is difficult to get reciepts for the payment made,1,2025-03-23,CBE,Google Play,negative,0.9993370175361633
this app is best,1,2025-03-23,CBE,Google Play,positive,0.9989839196205139
I'm sad guys what are you doing? Why did you add the screenshot restriction to the app? You just made it worse it was a great value to us. You need to rethink it. i will change the 1 star rating when you resolve the issue.,1,2025-03-22,CBE,Google Play,negative,0.9993658661842346
"Old version was very friendly to use. Now we can't see the #Reason The #transaction history (very limited) and now it crash every time it's opened. More over, the last update prevents us from taking #screenshots. Thanks for the developers as they are getting more stupid than ever.",1,2025-03-21,CBE,Google Play,negative,0.9987834095954895
What an absolutely terrible update. No screenshots and you still have this stupid restriction on developer options. WHAT ABOUT THOSE OF US WHO ARE ACTUALLY DEVELOPERS!!!!!! At this point telebirr just wins the game 100%. CBE. Do. Better!,1,2025-03-21,CBE,Google Play,positive,0.9841668605804443
how do you disable screenshots on a banking app you are very unserious people,1,2025-03-21,CBE,Google Play,negative,0.9976205229759216
"Not Good, too lame to use",1,2025-03-21,CBE,Google Play,negative,0.9997883439064026
Taking away the screenshot of the receipt is just silly. Worse is tbe download button putting a copy of the screenshot - which you prevented to be taken - in tbe downloads folder where we cant attach directly from Whatsapp. Millions of people use the screenshot as proof of payment / transfer yet you make that harder for everyone? I have every user contacts the developer or manager who made this awful decision.,1,2025-03-20,CBE,Google Play,negative,0.9997187256813049
the update is unneeded,1,2025-03-19,CBE,Google Play,negative,0.9976237416267395
The app need update it always crash,1,2025-03-13,CBE,Google Play,negative,0.9979516863822937
Asela,1,2025-03-13,CBE,Google Play,positive,0.9828375577926636
Unstatisfied with the new update keeps crashing every now and then and even though i haven't reached the max txn per day still refuses to transfer...probably going to change my bank if it's not fixed asap,1,2025-03-10,CBE,Google Play,negative,0.9992684721946716
It is one of the disappointed Bank you don't suppose to include Ethiopian on your name you don't deserve it.,1,2025-03-10,CBE,Google Play,negative,0.9991734623908997
"I have been using CBE App for long, but recently it has started crashing repeatedly and even my phone is reporting that the app has bugs and tells me to wait the developer to fix these bugs.",1,2025-03-09,CBE,Google Play,negative,0.9997072815895081
Why it asks me Update repeatedly as soon as I download it !!,1,2025-03-09,CBE,Google Play,negative,0.9959967136383057
Due to connection problem,1,2025-03-07,CBE,Google Play,negative,0.9959508180618286
Two step verification update is fake (meaningless). Why because the app gives you an option of to use pin while requesting two step verification step. 🔐 This updated app is not differ than the previous one in case of security & safegaurding users.👹👹💀💀 The other features of the app are best and easy to use it.⭐️⭐️⭐️⭐️⭐️,1,2025-03-06,CBE,Google Play,negative,0.8035405278205872
The app crashes too many times. It's a buggy app,1,2025-03-03,CBE,Google Play,negative,0.9997268319129944
So slow with Internet,1,2025-03-01,CBE,Google Play,negative,0.9990552067756653
It don't work,1,2025-02-28,CBE,Google Play,negative,0.9997726082801819
"It's a shame,it can't performe well,you guys can't even fix a bug, It's getting unusable, shame shame shame 😡",1,2025-02-28,CBE,Google Play,negative,0.9996347427368164
1 star because I have to visit my bank for new installation of the app and reactivation takes about 45 to 60 minutes with there long queue and system failures. Learn from telebire app and give options to customers to apt out of this ridiculous security feature. Second why is there no customization in the settings for displaying which account I want displayed in the first section rather that slide to my main account every time. You are making us pay a monthly subscription. Bare minimum is not it,1,2025-02-26,CBE,Google Play,negative,0.9993307590484619
Crashing frequently every time I try to log in.. it's so annoying,1,2025-02-25,CBE,Google Play,negative,0.9994563460350037
Constantly crashing after new update,1,2025-02-24,CBE,Google Play,negative,0.9982088804244995
"Why can't we use this app with Developer Mode turned on, when other big international banks apps allow it?",1,2025-02-22,CBE,Google Play,negative,0.9983769655227661
Why is it so hard to use this app why don't you make it simple like other apps sometimes it doesn't function right,1,2025-02-22,CBE,Google Play,negative,0.9993847608566284
couldnt update the app,1,2025-02-22,CBE,Google Play,negative,0.9958498477935791
"Too much commission and service charges, not fair at all this is stealing",1,2025-02-21,CBE,Google Play,negative,0.9996604919433594
Not working normally,1,2025-02-20,CBE,Google Play,negative,0.9995996356010437
"It lags before showing the transaction and you have to use the one in the sms message , why doesn't it work on the app it just says loading",1,2025-02-18,CBE,Google Play,negative,0.9993646740913391
"It's very good in reminding the account numbers you have been used, but Need to show recipient history whenever you want to present it.or it has to have a search on options for a spesfic time you want to look for receipts with out going for account details at bank. if you lost your receipt without downloading it and need to look sometime a while you can't get in simple search on the app.",1,2025-02-15,CBE,Google Play,negative,0.9966446161270142
"It crashes a lot; it doesn't work at all sometimes. By far, it is the worst mobile banking app I have ever used.",1,2025-02-15,CBE,Google Play,negative,0.9997912049293518
አለሚቱ ምስጋነዉ,1,2025-02-13,CBE,Google Play,negative,0.7850590348243713
This app now not open what's problem? Please solve it,1,2025-02-13,CBE,Google Play,negative,0.9984076619148254
በቅርቡ ችግር ተፈጥሯል ፣ Developer Option ካልተዘጋ አይሰራም፣ Developer Option ከተዘጋ ደግሞ ስልካችን ፍጥነት ለመታዘዝ ይዘገያል ፣ ከዚህ አማራጭ ሌላ ብትጠቀሙ ባይ ነኝ :: Android ላይ,1,2025-02-12,CBE,Google Play,negative,0.9661839604377747
It used to be better in the previous. But after the recent update it keeps crashing as soon as it logs in.. it needs to be fixed.,1,2025-02-11,CBE,Google Play,negative,0.9991856217384338
Can't even load our transaction history!!,1,2025-02-11,CBE,Google Play,negative,0.9994427561759949
CBE,1,2025-02-11,CBE,Google Play,positive,0.9966009855270386
It is stop working !,1,2025-02-10,CBE,Google Play,negative,0.9996010661125183
It shut down without warning,1,2025-02-10,CBE,Google Play,negative,0.9854583740234375
በፊት ጥሩነበር አሁን ምኑን ነካችሁት ተበላሽቷል አይሰራም,1,2025-02-08,CBE,Google Play,negative,0.9200406670570374
Recent transactions doesn't load properly sometimes . And also when transferring to someone sometimes it says failed and but already transferred which might cause to double transfer,1,2025-02-07,CBE,Google Play,negative,0.99915611743927
"It used to work properly, but not anymore. I used to use the app from abroad; but these days, it kept saying ""unable to connect"" when I tried to check my balance and do transactions.",1,2025-02-07,CBE,Google Play,negative,0.9991911053657532
Awash birr pro,1,2025-02-07,CBE,Google Play,negative,0.9963383674621582
Good,1,2025-02-07,CBE,Google Play,positive,0.9998161196708679
"After the new update I'm struggling to use this app,it suddenly crush or close automatically pls fix this problem",1,2025-02-05,CBE,Google Play,negative,0.9996976852416992
The app is crashing several times it's really annoying and sometimes it's says failed during different operations ?????? Please fix it!?,1,2025-02-04,CBE,Google Play,negative,0.9997221827507019
New update new version not working,1,2025-02-03,CBE,Google Play,negative,0.999659538269043
Too poor comparing to other countries.,1,2025-02-03,CBE,Google Play,negative,0.9996059536933899
Waww,1,2025-02-02,CBE,Google Play,negative,0.9088252782821655
"After the last two update, I am facing the worst experience with this app.",1,2025-02-02,CBE,Google Play,negative,0.999794065952301
Now it's crashing like crazy. It doesn't even open after a recent update.,1,2025-02-01,CBE,Google Play,negative,0.9995834231376648
without any reason it shows white screen and can't make transfers. Then when I went to branch then they reply go to the branch where you open your account.,1,2025-02-01,CBE,Google Play,negative,0.9968906044960022
It used to be the best bank app in Ethiopia. But now using it is a terrible experience. For every transaction it shows an error message. Making a simple payment requires 5 to 6 trials to complete.,1,2025-01-31,CBE,Google Play,negative,0.9970723390579224
it does not connect,1,2025-01-31,CBE,Google Play,negative,0.9997904896736145
The worst I had to flight back to fix my app it need you to go back every 4 month not reliable for foreigners,1,2025-01-31,CBE,Google Play,negative,0.9997552037239075
This should run for worst app of the year,1,2025-01-31,CBE,Google Play,negative,0.9997993111610413
Very bad,1,2025-01-31,CBE,Google Play,negative,0.9997884631156921
Bad,1,2025-01-31,CBE,Google Play,negative,0.999782383441925
No manage beneficiary for my app,1,2025-01-30,CBE,Google Play,negative,0.999631404876709
The latest updates crushes repeatedly on my Redmi Note 12 pro plus. If you could correct the issue.,1,2025-01-30,CBE,Google Play,negative,0.9994816184043884
Not worek recipient !!,1,2025-01-29,CBE,Google Play,negative,0.6950615644454956
"I’ve been using the CBE mobile banking app, and overall, I appreciate its features. However, I’ve noticed that when I turn on the developer options on my device, the app stops functioning properly. It would be great if you could look into this issue, as I often need to access developer settings for other applications. Thank you for your attention to this matter!",1,2025-01-29,CBE,Google Play,negative,0.9523299336433411
"If you are living outside of Ethiopia you better not deposit large money into your mobile account. It can kick you off any time for some small reasons and the only way you can recover is either to go to the bank in person or you need to have access to your phone which is impossible if you are living outside Ethiopia. The only option you will be left with is, you can't use your money. At least it would be better if you can recover your account using email or other verification ...",1,2025-01-29,CBE,Google Play,negative,0.9994357228279114
good app,1,2025-01-28,CBE,Google Play,positive,0.9998493194580078
Turning off the developers' options :( This is getting out of hand. We don't need to go through that...,1,2025-01-28,CBE,Google Play,negative,0.9956076741218567
I don't have an idea why our country soft wares needs some beroucracy?? How many peoples knew that about developer options N why is the new app forceing to disable that?? in my side i didn't get the apps as of b4.,1,2025-01-28,CBE,Google Play,negative,0.9992456436157227
Ti,1,2025-01-27,CBE,Google Play,positive,0.9913840293884277
Alert The device developer Mode is turned on. Please turn off Developer Mode from device settings and try again to use this app OK What is this ?,1,2025-01-27,CBE,Google Play,negative,0.99681156873703
"አፕልኬሽኑ የተላከልኝን ብር ቶሎ አያሳይም ። ከ 24 ሰዓት በላይ ይቆያል። ይህ ለቢዝነስ በጣም አስቸጋሪ ሆኖብኛል። መፍትሔ አላችሁ ? This application is too slow & inactive to notify & record transactions, & hence I faced difficulty using it for businesses. would you fix it?",1,2025-01-25,CBE,Google Play,negative,0.9996609687805176
"The app is simply trash, the only thing that's keeping them afloat is that the woods for the other Ethiopian banks is even trashier",1,2025-01-25,CBE,Google Play,negative,0.999788224697113
Data problems,1,2025-01-24,CBE,Google Play,negative,0.9996092915534973
it's not working properly,1,2025-01-24,CBE,Google Play,negative,0.9997792840003967
Make an option to send statement by email,1,2025-01-24,CBE,Google Play,negative,0.9493923783302307
It is simple and very accurate system,1,2025-01-24,CBE,Google Play,positive,0.999847412109375
እብድ ባነክ፣ ይሄ ዝምብሎ Update ብቻ የሚለውን እና Update የማያደርገውን ሲስተማችሁን አስተካክሉት። አናዳጆች!,1,2025-01-23,CBE,Google Play,negative,0.8708980083465576
very inconvenience to use. unreliable and needs upgrades!!!,1,2025-01-23,CBE,Google Play,negative,0.9996125102043152
The worst bank in Ethiopia!,1,2025-01-22,CBE,Google Play,negative,0.9997764229774475
Annoying app Very poor,1,2025-01-22,CBE,Google Play,negative,0.9997809529304504
"Why force-disable Developer Options in the latest update? I get that it's a security precaution, but it's overkill. Plenty of other financial apps do not require it and it's sometimes necessary for debugging/experimental reasons",1,2025-01-21,CBE,Google Play,negative,0.9979910850524902
Excellent app,1,2025-01-20,CBE,Google Play,positive,0.9998356103897095
"It was very convenient and cool to use, but for some reason it hasn't been working for me lately.",1,2025-01-20,CBE,Google Play,negative,0.8924981355667114
Breaks after a week,1,2025-01-19,CBE,Google Play,negative,0.9532126784324646
This application is an unreliable application. Please do not use it. Hackers will enter through the application and take the certificate from CBE.,1,2025-01-18,CBE,Google Play,negative,0.9993547797203064
Saadahmuu,1,2025-01-18,CBE,Google Play,negative,0.9790335297584534
The new update is seems force enable developer options on setting. And please fix the problem on iphones it only works for few days every time it get maintained at branches,1,2025-01-17,CBE,Google Play,positive,0.7807759046554565
This app is the worst the current release doesn't work when developers mode is on and the transaction errors make you transfer money twice with errors,1,2025-01-13,CBE,Google Play,negative,0.9996973276138306
Developer mode?????,1,2025-01-12,CBE,Google Play,negative,0.995884120464325
ዳኒል ትዛዙ,1,2025-01-11,CBE,Google Play,negative,0.7850590348243713
"I am facing difficulties related to network issues, while I have a good internet connection.",1,2025-01-11,CBE,Google Play,negative,0.8891944289207458
"Alert The device developer Mode is turned on. You can't use this app, Please turn off Developer Mode and try again. OK Why reason?",1,2025-01-11,CBE,Google Play,negative,0.9970587491989136
8 expriance,1,2025-01-08,CBE,Google Play,negative,0.742670476436615
Why do i have to close the developer option to use it. After the update it's not even working unless I close the developer option,1,2025-01-07,CBE,Google Play,negative,0.9997721314430237
"You can not track your transaction history with correct date, time and order",1,2025-01-07,CBE,Google Play,negative,0.9983684420585632
"Keep saying ""unable to connect"" after a normal phone update. Please update the app to match latest phone ""updates""",1,2025-01-07,CBE,Google Play,negative,0.9996213912963867
It's simple and easy to use,1,2025-01-06,CBE,Google Play,positive,0.9997555613517761
"i,ts not working, not good",1,2025-01-06,CBE,Google Play,negative,0.9998045563697815
Please Add A dark theme😭😭,1,2025-01-06,CBE,Google Play,positive,0.9205663204193115
I have been using it for a years and it is beautiful in i the time have been using it,1,2025-01-06,CBE,Google Play,positive,0.9997625946998596
Not functional when i need a transactions,1,2025-01-05,CBE,Google Play,negative,0.9996778964996338
Best,1,2025-01-05,CBE,Google Play,positive,0.9997941851615906
Is not working for last update,1,2025-01-05,CBE,Google Play,negative,0.9989091157913208
Why is it asking me for developer option,1,2025-01-05,CBE,Google Play,negative,0.9979903697967529
"We need more update soon! once I updated it, it authomatically stop working😭",1,2025-01-05,CBE,Google Play,negative,0.9997543692588806
good,1,2025-01-04,CBE,Google Play,positive,0.9998161196708679
Why did this application stopped working at the moment,1,2025-01-04,CBE,Google Play,negative,0.9997424483299255
"The worst update seen in the bank industry for mobile banking. If you're unable to make it smooth and reliable at the same time , return it to previous version. It shows that you don't have the best expertise like other banks in the country.",1,2025-01-04,CBE,Google Play,negative,0.9997628331184387
It's not working,1,2025-01-03,CBE,Google Play,negative,0.9997857213020325
What's your problem with developer option ???,1,2025-01-02,CBE,Google Play,negative,0.9991196990013123
i can't access this app without turning off the developer option mode 🤬👎,1,2025-01-02,CBE,Google Play,negative,0.9775353074073792
Always their is a mal function,1,2025-01-02,CBE,Google Play,negative,0.9996755123138428
It slow and unused app,1,2025-01-02,CBE,Google Play,negative,0.9996582269668579
Not working,1,2025-01-02,CBE,Google Play,negative,0.9997778534889221
Ok,1,2025-01-02,CBE,Google Play,positive,0.9997851252555847
"The not allowing the app while ""developer options"" is on needs to be fixed! Why the hell is an app telling me what to do with my own OS??? This is an unnecessary fix that needs to be fixed!!!",1,2025-01-01,CBE,Google Play,negative,0.9998024106025696
"The inconvenience of this app is that it requires developer options to be turned off. This hinders my ability to customize my phone as some of the customization can only be done in the developer options. Also, it didn't have this requirement before, so why now? And please return it how it was because this should not be an issue. Also, when a transaction is completed before it used to allow me to save the image of the completed transaction, now it doesn't, so please fix that also.",1,2025-01-01,CBE,Google Play,negative,0.9995642304420471
Worst update ever. It asked to disable the developer's option which they don't have any authority over. Most useless update ever. I wish I could give it a 0 star if it was possible. Why do you care about my phone's settings? Stupid developers. Should Switch to other banks.,1,2025-01-01,CBE,Google Play,negative,0.9998212456703186
It ask me your developer mode is on and its not working for me???,1,2025-01-01,CBE,Google Play,negative,0.9996711015701294
The last update is useless!!,1,2024-12-31,CBE,Google Play,negative,0.9997901320457458
Security,1,2024-12-31,CBE,Google Play,positive,0.9965950846672058
Its good app,1,2024-12-31,CBE,Google Play,positive,0.9998613595962524
The update isn't working,1,2024-12-31,CBE,Google Play,negative,0.9997337460517883
"No text, no update.....",1,2024-12-31,CBE,Google Play,negative,0.9989455342292786
It's really helpful,1,2024-12-31,CBE,Google Play,positive,0.9998189806938171
Weak update ! . b/c it stops when I want to set two step verification on. And it is only applicable if developer options are on. Why ??? Please tell me the reason 🙏,1,2024-12-31,CBE,Google Play,negative,0.9996737241744995
